{
  "schema_version": 1,
  "dataset_version": "2026.08.27.1",
  "updated_at": "2026-08-27",
  "records": [
    {
      "domain": "vtmpj.com",
      "classification": "disposable",
      "confidence": "high",
      "source_urls": [
        "https://verifymail.io/domain/vtmpj.com"
      ],
      "evidence_note": "VerifyMail identifies the domain as disposable, reports a valid mail server, and attributes the provider to 10minutemail.com.",
      "provider": "10minutemail.com",
      "first_seen": "2026-08-27",
      "last_verified": "2026-08-27",
      "block_subdomains": true,
      "status": "active"
    }
  ]
}
